{
  "$schema": "https://json-schema.org/draft/2020-12/schema",
  "$id": "https://portfolio-copilot/schemas/holdings.schema.json",
  "title": "HoldingsSnapshot",
  "description": "Current portfolio holdings. Unlike the IPS, this is current-state data — overwritten as holdings change, not versioned/append-only.",
  "type": "object",
  "required": ["user_id", "as_of", "positions"],
  "properties": {
    "user_id": { "type": "string" },
    "as_of": {
      "type": "string",
      "format": "date-time",
      "description": "When this snapshot was last refreshed."
    },
    "positions": {
      "type": "array",
      "items": {
        "type": "object",
        "required": ["ticker", "quantity", "asset_class", "market_value_usd"],
        "properties": {
          "ticker": { "type": "string" },
          "quantity": { "type": "number", "minimum": 0 },
          "asset_class": {
            "type": "string",
            "description": "Must match one of the IPS's target_allocation asset classes for drift comparison to be meaningful."
          },
          "market_value_usd": { "type": "number", "minimum": 0 },
          "account_type": {
            "type": "string",
            "enum": ["taxable", "retirement"]
          }
        }
      }
    },
    "cash_usd": { "type": "number", "minimum": 0 },
    "total_value_usd": {
      "type": "number",
      "minimum": 0,
      "description": "Sum of all positions' market_value_usd plus cash_usd. Denominator for drift and concentration checks."
    }
  }
}
